{
  "prereqs": [
    "Unix-like shell",
    "Ability to run bash scripts (chmod +x)",
    "sudo access (for installing binary)",
    "ln (to create symlink)"
  ],
  "install_steps": [
    {
      "step": "Change to the prompt-box directory",
      "command": "cd ~/prompt-box",
      "evidence": {
        "path": "README.md",
        "line_start": 12,
        "line_end": 12,
        "snippet_hash": "8472e1fe0def",
        "display": "README.md:12"
      }
    },
    {
      "step": "Make the pb script executable",
      "command": "chmod +x pb",
      "evidence": {
        "path": "README.md",
        "line_start": 13,
        "line_end": 13,
        "snippet_hash": "11ad9ae773c3",
        "display": "README.md:13"
      }
    },
    {
      "step": "Install pb as a global command by symlinking into /usr/local/bin",
      "command": "sudo ln -sf \"$(pwd)/pb\" /usr/local/bin/pb",
      "evidence": {
        "path": "README.md",
        "line_start": 14,
        "line_end": 14,
        "snippet_hash": "8f27053f74fb",
        "display": "README.md:14"
      }
    }
  ],
  "config": [
    {
      "name": "No configuration documented",
      "purpose": "No explicit config files or env vars required.",
      "evidence": {
        "path": "README.md",
        "line_start": 5,
        "line_end": 23,
        "snippet_hash": "cba310aac126",
        "display": "README.md:5-23"
      }
    }
  ],
  "run_dev": [
    {
      "step": "Echo or pipe a list of commands to pb check for safety classification",
      "command": "printf \"pwd\\nls -la\\n\" | pb check",
      "evidence": {
        "path": "README.md",
        "line_start": 17,
        "line_end": 17,
        "snippet_hash": "6e935fa72ffa",
        "display": "README.md:17"
      }
    },
    {
      "step": "Echo or pipe a list of commands to pb run for interactive execution (requires typing YES to confirm)",
      "command": "printf \"pwd\\nls -la\\n\" | pb run",
      "evidence": {
        "path": "README.md",
        "line_start": 18,
        "line_end": 18,
        "snippet_hash": "72c9329841eb",
        "display": "README.md:18"
      }
    }
  ],
  "run_prod": [
    {
      "step": "Run pb command after completing install steps (same as in development, since no deployment differences noted)",
      "command": "unknown",
      "evidence": null
    }
  ],
  "usage_examples": [
    {
      "description": "Check if commands would be allowed, reviewed, or blocked",
      "command": "printf \"pwd\\nls -la\\n\" | pb check"
    },
    {
      "description": "Actually execute ALLOW commands after interactive confirmation",
      "command": "printf \"pwd\\nls -la\\n\" | pb run"
    }
  ],
  "verification_steps": [
    {
      "step": "Attempt a dry-run using pb check with benign commands to confirm classification output",
      "command": "printf \"pwd\\nls -la\\n\" | pb check",
      "evidence": {
        "path": "README.md",
        "line_start": 17,
        "line_end": 17,
        "snippet_hash": "6e935fa72ffa",
        "display": "README.md:17"
      }
    }
  ],
  "common_failures": [
    {
      "symptom": "'pb' command not found",
      "cause": "Symlink not created or not in PATH",
      "fix": "Repeat sudo ln -sf command, confirm /usr/local/bin is in PATH"
    },
    {
      "symptom": "Permission denied when executing pb",
      "cause": "pb script is not executable",
      "fix": "Run chmod +x pb"
    },
    {
      "symptom": "Receipt files not being generated",
      "cause": "receipts/ directory is missing or not writable",
      "fix": "Create receipts/ directory with write permissions"
    }
  ],
  "unknowns": [
    {
      "what_is_missing": "Explicit documentation or sample for production mode/execution differences",
      "why_it_matters": "It's unclear if special handling is needed for production; may affect operation in non-local/dev environments.",
      "what_evidence_needed": "Documentation or source comments/pages describing production deployment or operation steps"
    },
    {
      "what_is_missing": "Specific environment variables or config options (if any)",
      "why_it_matters": "Operators may need to customize behavior or paths",
      "what_evidence_needed": "Any config file or ENV var references in script/docs"
    }
  ],
  "missing_evidence_requests": [
    "Production- vs development-mode distinction or invocation details",
    "Any configuration/environment settings aside from install path and permissions"
  ],
  "completeness": {
    "score": 79,
    "max": 100,
    "missing": [
      "port_behavior: no port evidence with verified snippet_hash"
    ],
    "deductions": [
      "-6 for 2 unknown(s)"
    ],
    "notes": "-6 for 2 unknown(s); No Dockerfile found; 2 unknown(s) reported"
  }
}