{
  "prereqs": [
    "Node.js 20 (or higher)",
    "jq",
    "Nix (for Replit/Nix builds)"
  ],
  "install_steps": [
    {
      "step": "Ensure Node.js 20 and jq are installed (on platforms using Nix: provided by replit.nix)",
      "command": null,
      "evidence": {
        "path": "replit.nix",
        "line_start": 2,
        "line_end": 5,
        "snippet_hash": "d23ae8857905",
        "display": "replit.nix:2-5"
      }
    }
  ],
  "config": [
    {
      "name": "run = \"node validate-schema.js\" (.replit)",
      "purpose": "Defines the main run command for Replit and deployment.",
      "evidence": {
        "path": ".replit",
        "line_start": 1,
        "line_end": 1,
        "snippet_hash": "eb5b96f312a1",
        "display": ".replit:1"
      }
    },
    {
      "name": "[nix] channel = \"stable-23_11\"",
      "purpose": "Specifies Nix channel used for dependency resolution in Replit.",
      "evidence": {
        "path": ".replit",
        "line_start": 4,
        "line_end": 4,
        "snippet_hash": "503e4d7a3efe",
        "display": ".replit:4"
      }
    }
  ],
  "run_dev": [
    {
      "step": "Run the schema validator script (e.g. validate-schema.js) locally using Node.js.",
      "command": "node validate-schema.js",
      "evidence": {
        "path": "README.md",
        "line_start": 27,
        "line_end": 27,
        "snippet_hash": "552aa2a53cfa",
        "display": "README.md:27"
      }
    }
  ],
  "run_prod": [
    {
      "step": "Run the validator script as used in deployment or CI (default: node validate-schema.js).",
      "command": "node validate-schema.js",
      "evidence": {
        "path": ".replit",
        "line_start": 1,
        "line_end": 1,
        "snippet_hash": "eb5b96f312a1",
        "display": ".replit:1"
      }
    }
  ],
  "usage_examples": [
    {
      "description": "Validate the ELI schema and sample output.",
      "command": "node validate-schema.js"
    }
  ],
  "verification_steps": [
    {
      "step": "Run the validator script and check that sample ELI outputs conform to JSON schema.",
      "command": "node validate-schema.js",
      "evidence": {
        "path": "README.md",
        "line_start": 20,
        "line_end": 20,
        "snippet_hash": "f8e4d31b7491",
        "display": "README.md:20"
      }
    }
  ],
  "common_failures": [
    {
      "symptom": "Schema validation fails.",
      "cause": "Input files do not conform to ELI JSON schema.",
      "fix": "Check and correct schema conformance for all inputs."
    },
    {
      "symptom": "Cannot find or execute node command.",
      "cause": "Node.js is not installed or not on PATH.",
      "fix": "Install Node.js 20 or higher and ensure it is available in your environment."
    }
  ],
  "unknowns": [
    {
      "what_is_missing": "Install instructions for environments other than Replit/Nix.",
      "why_it_matters": "Operators on Mac/Windows/Linux may not use Nix or Replit; their setup steps are unclear.",
      "what_evidence_needed": "Explicit install instructions for Node.js, jq, and dependency management outside of Nix."
    },
    {
      "what_is_missing": "Any steps for building, packaging, or deploying production artifacts outside schema validation.",
      "why_it_matters": "Needed for integrating ELI into CI/CD or downstream systems.",
      "what_evidence_needed": "Documentation or scripts specifying build or deployment processes."
    },
    {
      "what_is_missing": "Detailed examples showing the use of ELI with actual claims/evidence inputs and HALO integration.",
      "why_it_matters": "Operators may need to understand end-to-end workflow for claims with receipts.",
      "what_evidence_needed": "Sample commands, files, or outputs illustrating complete ELI \u2194 HALO usage."
    },
    {
      "what_is_missing": "Location and requirements for validate-schema.js script.",
      "why_it_matters": "Cannot verify operation unless the script location and expected inputs are clear.",
      "what_evidence_needed": "File listing or documentation describing validate-schema.js."
    }
  ],
  "missing_evidence_requests": [
    "Install steps for non-Nix/Non-Replit environments.",
    "Locations, purpose, and operation of validate-schema.js script.",
    "How to generate/prepare inputs for schema validation.",
    "Example output or logs from validation.",
    "Any integration or deployment steps beyond development validation."
  ],
  "completeness": {
    "score": 58,
    "max": 100,
    "missing": [
      "port_behavior: no port evidence with verified snippet_hash",
      "install_steps: no step with both a runnable command and verified evidence"
    ],
    "deductions": [
      "-12 for 4 unknown(s)"
    ],
    "notes": "-12 for 4 unknown(s); No Dockerfile found; 4 unknown(s) reported"
  }
}